{
  "$schema": "../../foundation/schemas/module.schema.json",

  "id": "hello-custom",
  "version": "1.0.0",
  "name": "Hello Custom Module",
  "description": "A close variant of the Hello Module that demonstrates running two copies side by side. It renders a configurable note driven by HELLO_CUSTOM_NOTE while keeping every other behavior identical.",

  "author": {
    "name": "PeerMesh Team"
  },
  "license": "MIT",
  "repository": "https://github.com/peermesh/hello-module",
  "tags": ["example", "hello-world", "nginx", "tutorial", "starter"],

  "foundation": {
    "minVersion": "1.0.0"
  },

  "requires": {
    "connections": [],
    "modules": []
  },

  "provides": {
    "connections": [],
    "events": [
      "hello-custom.page.served",
      "hello-custom.health.checked"
    ]
  },

  "security": {
    "enforcementMode": "warn",
    "identity": {
      "required": false,
      "credentialType": "any"
    },
    "encryption": {
      "dataAtRest": "none",
      "transitEncryption": "tls",
      "keyPurposes": []
    },
    "contract": {
      "network": {
        "access": "proxy-external"
      },
      "filesystemAccess": {
        "accessLevel": "own-directory-only"
      }
    }
  },

  "dashboard": {
    "displayName": "Hello Custom Module",
    "icon": "hand-wave",
    "routes": [
      {
        "path": "/hello-custom",
        "component": "./dashboard/HelloCustomStatusWidget.html",
        "nav": {
          "label": "Hello Custom",
          "icon": "hand-wave",
          "order": 200
        }
      }
    ],
    "statusWidget": {
      "component": "./dashboard/HelloCustomStatusWidget.html",
      "size": "small",
      "order": 200
    }
  },

  "lifecycle": {
    "install": {
      "script": "./hooks/install.sh",
      "timeout": 60,
      "retries": 1
    },
    "start": {
      "script": "./hooks/start.sh",
      "timeout": 60
    },
    "stop": {
      "script": "./hooks/stop.sh",
      "timeout": 30
    },
    "uninstall": "./hooks/uninstall.sh",
    "health": {
      "script": "./hooks/health.sh",
      "timeout": 15
    }
  },

  "config": {
    "version": "1.0",
    "properties": {
      "greeting": {
        "type": "string",
        "description": "The greeting message displayed on the page",
        "default": "Hello from PeerMesh Custom",
        "env": "HELLO_CUSTOM_GREETING"
      },
      "customNote": {
        "type": "string",
        "description": "A short note highlighting the hello-custom variant",
        "default": "Custom variant engaged",
        "env": "HELLO_CUSTOM_NOTE"
      },
      "domain": {
        "type": "string",
        "description": "The domain where Docker Lab is hosted",
        "env": "DOMAIN"
      },
      "subdomain": {
        "type": "string",
        "description": "The subdomain prefix for this module",
        "default": "hello-custom",
        "env": "HELLO_CUSTOM_SUBDOMAIN"
      }
    },
    "required": ["domain"]
  }
}
